{
  "binding_algorithm": "sha256-segment-key-nul-html-path-nul-canonical-text-v1",
  "content_path": "source/id-ID/O005-BRIDGE-C3/content.html",
  "content_sha256": "6f16b026417252c5307c03a88272fc55542e955263cd85f6f82338e33065ed53",
  "entries": [
    {
      "segment_id": "O005-BRIDGE-C3-S0001",
      "segment_key": "c3/objectives/title",
      "slot_binding_sha256": "a6b822224c46a371ab8b0b7ad1554ef87d76a40e2e7af9839bde32d8cb4921ec",
      "state": "active"
    },
    {
      "segment_id": "O005-BRIDGE-C3-S0002",
      "segment_key": "c3/objectives/lead",
      "slot_binding_sha256": "ba7c583ba73f9ddd0aa664faebcf62057949d147f817ef2e8adc64221a8f8702",
      "state": "active"
    },
    {
      "segment_id": "O005-BRIDGE-C3-S0003",
      "segment_key": "c3/objectives/item-determinism",
      "slot_binding_sha256": "6b68507d3729f26e1c11b9673dfc5a097a850a91738d0dac6c83687a6e501a8f",
      "state": "active"
    },
    {
      "segment_id": "O005-BRIDGE-C3-S0004",
      "segment_key": "c3/objectives/item-logistic-stability",
      "slot_binding_sha256": "8ebdca6c23f02ceb54855c039add4a3a2099569210a427ec863332fe1eb42a74",
      "state": "active"
    },
    {
      "segment_id": "O005-BRIDGE-C3-S0005",
      "segment_key": "c3/objectives/item-lyapunov",
      "slot_binding_sha256": "c3c04d22b5451c764d6f576c87caf99d3b87c581d8fea292c0444ff365b4ba77",
      "state": "active"
    },
    {
      "segment_id": "O005-BRIDGE-C3-S0006",
      "segment_key": "c3/objectives/item-lorenz",
      "slot_binding_sha256": "63d4a2b23a59ebd669958f67816e6cee1d40188c9a6eb9e5440156eda00f4df7",
      "state": "active"
    },
    {
      "segment_id": "O005-BRIDGE-C3-S0007",
      "segment_key": "c3/objectives/item-poincare",
      "slot_binding_sha256": "15af2f4c7626e9d4eccd4cb94784efa4f318fb1f77f70afb2c3a9b575dc47024",
      "state": "active"
    },
    {
      "segment_id": "O005-BRIDGE-C3-S0008",
      "segment_key": "c3/provenance/title",
      "slot_binding_sha256": "c6443bb6ac4383e0ded75c8bd761237c5f5cb8fd6a25c3863d4c00456d94eb28",
      "state": "active"
    },
    {
      "segment_id": "O005-BRIDGE-C3-S0009",
      "segment_key": "c3/provenance/relationship",
      "slot_binding_sha256": "2f899a701bc24a3ad4ced2a51718446c55a00cbc4d8dc90020ac8655502325df",
      "state": "active"
    },
    {
      "segment_id": "O005-BRIDGE-C3-S0010",
      "segment_key": "c3/provenance/model",
      "slot_binding_sha256": "9ecd4bf9e4b3e67de336a8ce31069ddaf54c9b3741a29e5f54e24d1a41d3e73c",
      "state": "active"
    },
    {
      "segment_id": "O005-BRIDGE-C3-S0011",
      "segment_key": "c3/sec01/title",
      "slot_binding_sha256": "0dc79c2ea95fdcf4df2fd2afa864e729a2199e1a516ffc364721d296ae5a7c20",
      "state": "active"
    },
    {
      "segment_id": "O005-BRIDGE-C3-S0012",
      "segment_key": "c3/sec01/deterministic-rule",
      "slot_binding_sha256": "dd999475946f91c64a78a6363e71f6f264d605940c538182ccc4de1f94c69a4d",
      "state": "active"
    },
    {
      "segment_id": "O005-BRIDGE-C3-S0013",
      "segment_key": "c3/sec01/evidence-boundary",
      "slot_binding_sha256": "ad3bfb67b4331d7e729f76c6d9a38ada7834eea64cf63156044c9691b4ca5357",
      "state": "active"
    },
    {
      "segment_id": "O005-BRIDGE-C3-S0014",
      "segment_key": "c3/sec01/principle-title",
      "slot_binding_sha256": "14130cd6a6b5da8d4afeaced1f6939a9c9243e6401eaeb6fc03fffea9b5dd95e",
      "state": "active"
    },
    {
      "segment_id": "O005-BRIDGE-C3-S0015",
      "segment_key": "c3/sec01/principle-text",
      "slot_binding_sha256": "7e7465fc4ab7cf38c34af62b217eb59413a72ae7d362c790af8520913f9ddc92",
      "state": "active"
    },
    {
      "segment_id": "O005-BRIDGE-C3-S0016",
      "segment_key": "c3/sec02/title",
      "slot_binding_sha256": "173cf7c162ac95b9e5267c2e5e40b3d0034089f128cb89a8fc15ba64149f5e7e",
      "state": "active"
    },
    {
      "segment_id": "O005-BRIDGE-C3-S0017",
      "segment_key": "c3/sec02/model-definition",
      "slot_binding_sha256": "e443f6b397cf43f7f9fa9fda1eab3d44c491c1de9eddae5fbd109b13c480123d",
      "state": "active"
    },
    {
      "segment_id": "O005-BRIDGE-C3-S0018",
      "segment_key": "c3/sec02/equation-logistic",
      "slot_binding_sha256": "d2bbbb2ab3bf11c10c8aebb41acb0b10495df0f53359104f249b93fd9e7a39c3",
      "state": "active"
    },
    {
      "segment_id": "O005-BRIDGE-C3-S0019",
      "segment_key": "c3/sec02/variables",
      "slot_binding_sha256": "6806854a268abf8cdefc15cf5becd15d8a78509764fea293677dbe0b350d9028",
      "state": "active"
    },
    {
      "segment_id": "O005-BRIDGE-C3-S0020",
      "segment_key": "c3/sec02/invariant-proof",
      "slot_binding_sha256": "fdbe96133d2f25975f0199fc6c6bdc89eb4d3bfebba1f254fcfe72f5c7aa10e3",
      "state": "active"
    },
    {
      "segment_id": "O005-BRIDGE-C3-S0021",
      "segment_key": "c3/sec02/iteration-warning",
      "slot_binding_sha256": "a0bdc7f233769c08ba4cff43d7540a23edd61ddf31700f444a66ac2f094967ad",
      "state": "active"
    },
    {
      "segment_id": "O005-BRIDGE-C3-S0022",
      "segment_key": "c3/sec03/title",
      "slot_binding_sha256": "bb36f66d6d5ba762e3bcb9ccc65d1715e5e37875e5fb44ae3d3660201093945d",
      "state": "active"
    },
    {
      "segment_id": "O005-BRIDGE-C3-S0023",
      "segment_key": "c3/sec03/fixed-points-derivation",
      "slot_binding_sha256": "779130d31b957f617c28b5c6c19fa93854e9b9bf7101f4d318d57eee5f29c95c",
      "state": "active"
    },
    {
      "segment_id": "O005-BRIDGE-C3-S0024",
      "segment_key": "c3/sec03/equation-fixed-points",
      "slot_binding_sha256": "86a7217085cd607b97b1c42bc03783cff8c6a78cf3add44b3f78dcb91b6e4dff",
      "state": "active"
    },
    {
      "segment_id": "O005-BRIDGE-C3-S0025",
      "segment_key": "c3/sec03/multiplier-rule",
      "slot_binding_sha256": "5bc2981df772b69f63dd9962141da32fba342b05e91291ffc7d2b4e5d4d056b4",
      "state": "active"
    },
    {
      "segment_id": "O005-BRIDGE-C3-S0026",
      "segment_key": "c3/sec03/stability-table-caption",
      "slot_binding_sha256": "0eff2e401db68f0a43438c45658a7b80e48eb46a4d73beef148006673e24ae6c",
      "state": "active"
    },
    {
      "segment_id": "O005-BRIDGE-C3-S0027",
      "segment_key": "c3/sec03/stability-header-point",
      "slot_binding_sha256": "3469b6c388eadb2b5811176e44e4469a60b254356bb6a6990dd767b07a27b87f",
      "state": "active"
    },
    {
      "segment_id": "O005-BRIDGE-C3-S0028",
      "segment_key": "c3/sec03/stability-header-multiplier",
      "slot_binding_sha256": "01f4f4275ee3f0802748b7cc790c07efa53079cda3b05cbb33df7f638b686cbb",
      "state": "active"
    },
    {
      "segment_id": "O005-BRIDGE-C3-S0029",
      "segment_key": "c3/sec03/stability-header-interval",
      "slot_binding_sha256": "aebd314b0c703e95a5926f5cab0f8d0538380a3515191826ae4cca58bbc291df",
      "state": "active"
    },
    {
      "segment_id": "O005-BRIDGE-C3-S0030",
      "segment_key": "c3/sec03/stability-row-zero-point",
      "slot_binding_sha256": "bb9f3982cc4e32c2596ce5c8e99bf0c2eb9751f6451d67a7b6355080a85fba6b",
      "state": "active"
    },
    {
      "segment_id": "O005-BRIDGE-C3-S0031",
      "segment_key": "c3/sec03/stability-row-zero-multiplier",
      "slot_binding_sha256": "df2da17d0f5fa4612efa551ded4add0fd908653d65972baecb944a5a3c0d7b4d",
      "state": "active"
    },
    {
      "segment_id": "O005-BRIDGE-C3-S0032",
      "segment_key": "c3/sec03/stability-row-zero-interval",
      "slot_binding_sha256": "4c9975452cb277968a14404144a295aaf78b0b6a0d26c57e74cc707687a1cd2b",
      "state": "active"
    },
    {
      "segment_id": "O005-BRIDGE-C3-S0033",
      "segment_key": "c3/sec03/stability-row-nonzero-point",
      "slot_binding_sha256": "bfc47a6df70ba9390040dbef5ba6df91b5fbabfe5ac3a2ed3f280745424f2d3c",
      "state": "active"
    },
    {
      "segment_id": "O005-BRIDGE-C3-S0034",
      "segment_key": "c3/sec03/stability-row-nonzero-multiplier",
      "slot_binding_sha256": "d48e0a3125d962bfbaff067e4a225a6ee7882b7ccdad64e8429f6259db6f585e",
      "state": "active"
    },
    {
      "segment_id": "O005-BRIDGE-C3-S0035",
      "segment_key": "c3/sec03/stability-row-nonzero-interval",
      "slot_binding_sha256": "42bd656380dd89da7f56b4591a99deca747a0daa6a7cbca9804a8255e15e19d6",
      "state": "active"
    },
    {
      "segment_id": "O005-BRIDGE-C3-S0036",
      "segment_key": "c3/sec03/period-doubling-transition",
      "slot_binding_sha256": "449e6faaaf58397ca66a71d55bf1ab7acbca0b62a375c4c4c2d150d100f2e36a",
      "state": "active"
    },
    {
      "segment_id": "O005-BRIDGE-C3-S0037",
      "segment_key": "c3/sec03/equation-two-cycle",
      "slot_binding_sha256": "4aa3d12837a53ca8d5e2c48ceca6822422ac0ac338b1a1775cda6d4cc45e541c",
      "state": "active"
    },
    {
      "segment_id": "O005-BRIDGE-C3-S0038",
      "segment_key": "c3/sec03/prime-period",
      "slot_binding_sha256": "8a167f55a3af5281e316818840cda98a90f430b538d12a13e1d17ba2500ac2ef",
      "state": "active"
    },
    {
      "segment_id": "O005-BRIDGE-C3-S0039",
      "segment_key": "c3/sec03/cycle-multiplier",
      "slot_binding_sha256": "01247cf4f42a2094af878a36e5a01891989e1fc3ee1d703933b11d9b6233b8f8",
      "state": "active"
    },
    {
      "segment_id": "O005-BRIDGE-C3-S0040",
      "segment_key": "c3/sec03/equation-cycle-multiplier",
      "slot_binding_sha256": "24ac5802c62fc31b82708172f299b081990881ece96c980505060702402e8690",
      "state": "active"
    },
    {
      "segment_id": "O005-BRIDGE-C3-S0041",
      "segment_key": "c3/sec03/two-cycle-stability",
      "slot_binding_sha256": "bad66f486801228d36b1539415bd92d246fbb456bf36430f5d72075babb3b23f",
      "state": "active"
    },
    {
      "segment_id": "O005-BRIDGE-C3-S0042",
      "segment_key": "c3/sec04/title",
      "slot_binding_sha256": "af5093137f1a23a99f772363fbb1efb8e9edd960aa242c179fb5a6dced4e5bdf",
      "state": "active"
    },
    {
      "segment_id": "O005-BRIDGE-C3-S0043",